{
  "label_aliases": {
    "attention kernel": "Attention Kernels",
    "diffusion language models": "Diffusion Language Models",
    "gpu kernel optimization": "GPU Kernel Optimization",
    "gpu systems": "GPU Systems",
    "inference optimization": "Inference Optimization",
    "kv cache": "KV Cache",
    "llm inference acceleration": "LLM Inference",
    "llm serving": "LLM Serving",
    "parallel decoding": "Parallel Decoding",
    "serving systems": "LLM Serving",
    "speculative decoding": "Speculative Decoding",
    "transformer": "Transformer"
  },
  "role_order": [
    "foundation",
    "baseline",
    "main",
    "system",
    "variant",
    "followup",
    "survey"
  ],
  "status_values": [
    "unread",
    "skimmed",
    "reading",
    "read",
    "archived"
  ],
  "active_status_workflow": "personal",
  "status_workflows": {
    "personal": {
      "status_values": [
        "unread",
        "skimmed",
        "reading",
        "read",
        "archived"
      ],
      "reading_stage_values": [
        "skim",
        "normal_read",
        "deep_read",
        "code_checked"
      ],
      "review_stage_values": [
        "fresh",
        "due",
        "reviewed"
      ]
    },
    "research": {
      "status_values": [
        "inbox",
        "triaged",
        "reading",
        "implemented",
        "cited",
        "archived"
      ],
      "reading_stage_values": [
        "skim",
        "normal_read",
        "deep_read",
        "code_checked",
        "reproduced"
      ],
      "review_stage_values": [
        "fresh",
        "due",
        "reviewed",
        "evergreen"
      ]
    }
  },
  "reading_stage_values": [
    "skim",
    "normal_read",
    "deep_read",
    "code_checked"
  ],
  "review_stage_values": [
    "fresh",
    "due",
    "reviewed"
  ],
  "shared_views": [
    {
      "name": "重点论文",
      "page": "all",
      "state": {
        "importance": "5",
        "sort": "importance"
      }
    },
    {
      "name": "未设置复习",
      "page": "index",
      "state": {
        "review": "none",
        "sort": "importance"
      }
    },
    {
      "name": "Attention Kernels",
      "page": "library",
      "state": {
        "track": "Attention Kernels",
        "sort": "year"
      }
    }
  ]
}
